Trial 187 finished with value: 0.3978522515044616 and parameters: {'C': 4.573606588483818, 'kernel': 'rbf', 'degree': 4, 'gamma': 'auto', 'coef0': 5.749697490961246, 'chi2_k': 2044}. Best is trial 141 with value: 0.7076101468624834.
Trial 188 finished with value: 0.6800384037401904 and parameters: {'C': 7.3951940977708315, 'kernel': 'rbf', 'degree': 4, 'gamma': 'scale', 'coef0': 6.289786337032645, 'chi2_k': 1992}. Best is trial 141 with value: 0.7076101468624834.
Trial 189 finished with value: 0.6846948356807512 and parameters: {'C': 10.842933742019948, 'kernel': 'rbf', 'degree': 4, 'gamma': 'scale', 'coef0': 6.527840319020915, 'chi2_k': 2164}. Best is trial 141 with value: 0.7076101468624834.
Trial 190 finished with value: 0.3261538461538462 and parameters: {'C': 5.358362905331241, 'kernel': 'sigmoid', 'degree': 4, 'gamma': 'scale', 'coef0': 6.755076984259503, 'chi2_k': 2225}. Best is trial 141 with value: 0.7076101468624834.
Trial 191 finished with value: 0.6984729639519359 and parameters: {'C': 6.799729923747028, 'kernel': 'rbf', 'degree': 4, 'gamma': 'scale', 'coef0': 5.874820968610015, 'chi2_k': 2131}. Best is trial 141 with value: 0.7076101468624834.
Trial 192 finished with value: 0.6984729639519359 and parameters: {'C': 7.313452640264697, 'kernel': 'rbf', 'degree': 4, 'gamma': 'scale', 'coef0': 5.783729494353794, 'chi2_k': 2132}. Best is trial 141 with value: 0.7076101468624834.
Trial 193 finished with value: 0.6757720457910212 and parameters: {'C': 3.871546944116608, 'kernel': 'rbf', 'degree': 4, 'gamma': 'scale', 'coef0': 6.047554925939096, 'chi2_k': 2066}. Best is trial 141 with value: 0.7076101468624834.
Trial 194 finished with value: 0.6798245614035088 and parameters: {'C': 10.62793927530616, 'kernel': 'rbf', 'degree': 4, 'gamma': 'scale', 'coef0': 7.141079918377103, 'chi2_k': 2188}. Best is trial 141 with value: 0.7076101468624834.
Trial 195 finished with value: 0.6984729639519359 and parameters: {'C': 7.328071001601716, 'kernel': 'rbf', 'degree': 4, 'gamma': 'scale', 'coef0': 5.476391942193021, 'chi2_k': 2136}. Best is trial 141 with value: 0.7076101468624834.
Trial 196 finished with value: 0.6432330827067669 and parameters: {'C': 13.418086990452968, 'kernel': 'rbf', 'degree': 4, 'gamma': 'scale', 'coef0': 6.365431303719874, 'chi2_k': 2073}. Best is trial 141 with value: 0.7076101468624834.
Trial 197 finished with value: 0.6894912427022519 and parameters: {'C': 5.265087528950572, 'kernel': 'rbf', 'degree': 4, 'gamma': 'scale', 'coef0': 4.413605842359699, 'chi2_k': 2157}. Best is trial 141 with value: 0.7076101468624834.
Trial 198 finished with value: 0.6894912427022519 and parameters: {'C': 3.470406216634681, 'kernel': 'rbf', 'degree': 4, 'gamma': 'scale', 'coef0': 6.243338190860576, 'chi2_k': 2230}. Best is trial 141 with value: 0.7076101468624834.
Trial 199 finished with value: 0.6520903010033445 and parameters: {'C': 17.315389987514543, 'kernel': 'rbf', 'degree': 4, 'gamma': 'scale', 'coef0': 6.603397710274188, 'chi2_k': 2023}. Best is trial 141 with value: 0.7076101468624834.
